{
  "schema_version": "datapan.health-probe.v1",
  "probe_id": "7b8ce434-e662-4f17-a239-0b8ad0d6a29b",
  "observed_at": "2026-07-13T00:00:00Z",
  "operation": {
    "operation_key": "1111111111111111111111111111111111111111111111111111111111111111",
    "dataset_id": "15102102",
    "operation_name": "population",
    "provider": "kosis",
    "endpoint_host": "kosis.kr",
    "endpoint_path": "/openapi/population",
    "dependency_class": "public_api"
  },
  "registry": {
    "dataset_id": "15102102",
    "dataset_revision": "aaaaaaaaaaaaaaaaaaaaaaaaaaaaaaaaaaaaaaaa",
    "registry_sha256": "bbbbbbbbbbbbbbbbbbbbbbbbbbbbbbbbbbbbbbbbbbbbbbbbbbbbbbbbbbbbbbbb",
    "manifest_sha256": "cccccccccccccccccccccccccccccccccccccccccccccccccccccccccccccccc"
  },
  "execution": { "cli_version": "0.10.0", "attempted": true, "timeout_ms": 10000, "request_budget": 1, "safe_parameter_names": ["period"] },
  "observation": { "max_level": "L4", "latency_ms": 142, "http_status": 200, "provider_code": "OK", "provider_message_class": "normal", "semantic_status": "verified", "body_shape": "rows:1", "data_presence": "present", "schema_status": "not_observed", "freshness_status": "not_observed" },
  "assessment": { "outcome": "healthy", "category": "healthy", "retryable": false, "reason_code": "verification_succeeded", "next_actions": ["none"] },
  "redaction": { "credentials_removed": true, "query_values_removed": true, "response_rows_removed": true }
}
